{
  "schema_version": "0.1.0",
  "output_type": "candidate_annual_weighting_audit",
  "selection_status": "candidate",
  "inference_performed": false,
  "scientific_acceptance": "not_performed",
  "module": {
    "id": "air_temperature_2m_annual_weighting",
    "version": "0.1.0"
  },
  "region": {
    "id": "B",
    "label": "Kuzey Alaska aday dikdörtgeni: parçalı erişim teknik modül denemesi",
    "selection_status": "candidate",
    "candidate_bbox": [
      -156,
      68,
      -150,
      70
    ],
    "candidate_window_version": "search-window-0.1.0"
  },
  "variable": {
    "id": "air_temperature_2m",
    "unit": "degC",
    "height_m": 2
  },
  "spatial_support": {
    "kind": "unmasked_rectangular_window",
    "mask": "none",
    "cell_count": 55,
    "window_area_m2": 53169123845.32998,
    "grid_step_degrees": {
      "longitude": 0.625,
      "latitude": 0.5
    },
    "request_envelope_bbox": [
      -156.3125,
      67.75,
      -149.6875,
      70.25
    ]
  },
  "time": {
    "frequency": "annual",
    "input_frequency": "monthly",
    "calendar": "gregorian",
    "provider_time_standard": "LST",
    "start": "2001",
    "end": "2024"
  },
  "method": {
    "id": "compare_annual_temperature_weighting",
    "version": "0.1.0",
    "selection_status": "candidate",
    "selected_weighting": null,
    "missing_policy": "require_12_complete_months",
    "inference": "not_performed",
    "provider_value_role": "comparison_only"
  },
  "weighting_definitions": [
    {
      "id": "equal_months",
      "formula": "sum(T_m / 12)",
      "target": "mean_of_twelve_monthly_values"
    },
    {
      "id": "calendar_days",
      "formula": "sum(T_m * days_m / days_year)",
      "target": "calendar_day_weighted_monthly_values"
    }
  ],
  "provenance": {
    "provider": "NASA POWER",
    "product": "POWER Monthly and Annual API",
    "api_version": "v2.10.0",
    "sources": [
      "MERRA2"
    ],
    "annual_sources": [
      {
        "year": 2001,
        "files_sha256": {
          "manifest.json": "57cd9b1ae12ac3e6ee2aec6cedbd399424b60ddddfe1dd3e66cc3f0fc358587d",
          "request.json": "605d5fe124ff764edf33a73629ad55b364f35a149aeab4b73aeaab40b0c6a21b",
          "result.json": "a5688d14acf495e49ef1fff7f37dc9eefeb3eb8a1d185b020dca611fbe2ace9d",
          "tile-001.json": "3a59a1144f13c10d4038056f48de1c7cfe0c726b24ae09f183b801d54a73eaa8",
          "tile-002.json": "badd0b90b6801f9cb3c505a829b1acb2628c10ccdfc3609ab4a58f156c02a54f"
        }
      },
      {
        "year": 2002,
        "files_sha256": {
          "manifest.json": "71d41a8f283f30881c6b742c5a74a998e1eda447dbd720294bd19e29bdc75ae6",
          "request.json": "b0bc4a2cadc7864a48fceeff2b440cf2f1dd226a4a020c1f2c9cddaa737b0f0e",
          "result.json": "1063c06492fa152517d87abeb2dcc5d7a761c6a92758feef0493e5bb064bf319",
          "tile-001.json": "1ed464109077d4be229665c8cfa6c4f749f6e7b50d4b6ebb72faf7829a9407a9",
          "tile-002.json": "f5938257bdbdf39001f40352d9db8042c9baa7677cdddceec69894a6dfcae51a"
        }
      },
      {
        "year": 2003,
        "files_sha256": {
          "manifest.json": "fa0496ba6c734390b9b80f372da7e1f457ab87b91672846c50eb25308ddc4b67",
          "request.json": "2f88d2906240f1ded68da9ab0fef819b73701bb2646fb85e374b07cd181add39",
          "result.json": "2617ddc7c3d3ca65db3ab8b3479a91e03ca24bc149cdf4a75af84d3b09b52edf",
          "tile-001.json": "db0c70530cf79a1f00e2d4e820ae4f63d78f6fd090a3be7a3067bd21b34becec",
          "tile-002.json": "4a80c3b5d4bde20cc80d778d429dfbcbe36666fabddeefef4a83d296a46c7a9b"
        }
      },
      {
        "year": 2004,
        "files_sha256": {
          "manifest.json": "92dd65be64003c80311adb00838e5aac06772832560b4b8cf5128ca7cc27cdba",
          "request.json": "9370b572eaf341c17a27cd43ae010d344ce1af4c836f947945be258ec87a92af",
          "result.json": "13e01254b3eb81e884a825fbe9146ccfb6ab64918c9a7aaa18edf6dbc8fdc92e",
          "tile-001.json": "13920de444bf36f1445bd6c5dfbb6b5d7bc8b3eeea15966e6bfc4e54dff67620",
          "tile-002.json": "d81ee9d6ffb43fced6f36980dcc4599b88caffa2ad65d3384eabb05e4881d560"
        }
      },
      {
        "year": 2005,
        "files_sha256": {
          "manifest.json": "e063035ddce14395de914ccddbe73a4e8ba7dd79cb1f225e8ab609f54c576c4e",
          "request.json": "2687d6f4c2c30de4be9f7b8877e2e7137700f00b1d638fbc72e517c1e2d09e78",
          "result.json": "c2a453b81ca71a2b227eb4d2995c9535db4fcff5c93b3a0507cd1eb52587934b",
          "tile-001.json": "00d360613b7ddb133f6203c16f6d46174383a41a1144e413bc8b98e6f9880237",
          "tile-002.json": "cfdc1fb155033842b8f6be95f8fff1d3ea881d2a5c483693dac3a51905910176"
        }
      },
      {
        "year": 2006,
        "files_sha256": {
          "manifest.json": "95cdc14c8275e0ad088060ebcbbfed52c3fb64b74971f4a37afa1f62daaffd2e",
          "request.json": "74b71e4477d85ef2bd088978b64987a87bce0f70b858524ad9304f0f9bcbc748",
          "result.json": "281022896030e520564e5326e1d3a24afb669166291bc07787e6f25b66635177",
          "tile-001.json": "0de842156956576f49e585b9c2ef46defd0fd182605ed87f8c112327497e1152",
          "tile-002.json": "92aac756e478210f49e93b69e18a92d9c3280f9f06657d4b039ca7ea04af0ec3"
        }
      },
      {
        "year": 2007,
        "files_sha256": {
          "manifest.json": "10740e372b4ed5b09e42474b024f6a01e4557efd270cecec1f5cf9f8ae5cb7e6",
          "request.json": "98997aea8bf1f0f354a5a249d5bc094cd191150fc1b3d67f774df57610eb8682",
          "result.json": "e2da7c1acbb5fa9e2863aafcd5c634b50e069589d40406c34ebed77a6ad3cdff",
          "tile-001.json": "fc72b516f939afc88d45aa43ae118febb301795cdc72afd20475a16b62851072",
          "tile-002.json": "2e4100bd81daeb2a470c0b6a90e1a479d1e68cc198d2db313f4d64c15c8ee9bf"
        }
      },
      {
        "year": 2008,
        "files_sha256": {
          "manifest.json": "d3e02d6e3c866a8aae2819b353431e811c4c71da00e95956e6d94867d07d7fae",
          "request.json": "1f3de60425b0a29466e3e8489fdb957c939f829dfe82c64ac78008a210b9591a",
          "result.json": "d13c53b47c92d04cad82610de0f46342b4e954b3a0449fda8fef58c8e9d16551",
          "tile-001.json": "7147e4caadb18c4dabde4f3130c2fafcc8388cc96a4f232b8009c4d7e2daa85a",
          "tile-002.json": "3540f0c76d939df31686d157130c5cf0f59a21e37aa013ce8658ef895f48da13"
        }
      },
      {
        "year": 2009,
        "files_sha256": {
          "manifest.json": "982052066031d8a5915095f26c4665cd678e35895ffaa29052271e0ca73eff0a",
          "request.json": "744ac5116fcbef837bcbdf3ab19a397a9f754291a74422fb94f498a4fbed231e",
          "result.json": "3440705ebb8aa843ebf15a43be8b001a99529c788b8ff4c6c6f987790591474e",
          "tile-001.json": "31c4e35f14e780398bfa28cbc08162d12baa4a8e15f5d25079747ac30cea9575",
          "tile-002.json": "ca132290813199e908e718b0d22d5d5ff029392d20c07b613cfafa2a440a2aad"
        }
      },
      {
        "year": 2010,
        "files_sha256": {
          "manifest.json": "30778e73b32e55d7c8aa1bec31a5d667bceb91376367f472fa1a2a2f1a872c87",
          "request.json": "5fe13a00a6164cb74848566a79b8e8a08886bfeb154e4b8667d4926cfb1b664b",
          "result.json": "19ebc77aee282325b901ea566053ac9e26fa2093b261ef5c49b7414a2cca140c",
          "tile-001.json": "3e2f04b054a5e8a9d7911e66fe9ad47af30f5728649dc8c02b03e664585d82e7",
          "tile-002.json": "d42a614ec9558f1af21692f01b7a99da186e2fee3bc8aa19d87158e306f2ac28"
        }
      },
      {
        "year": 2011,
        "files_sha256": {
          "manifest.json": "428f8f6e75c6514ff423d9a993efc1a9fbaaa5e8aa14c2434e63021fd01502e1",
          "request.json": "cb89ceef0ddfa21f966c3d984263143903ccfcb6706664a78b8eddb6f8d3c95f",
          "result.json": "e4568f21fa16dd9a0b14c9f88985fc6c4ee776fc51b3f771e32d536b729edb71",
          "tile-001.json": "1cdbe198163e20e93233d7ba46c9b51501e508842be1c91a7f8684d8899075a6",
          "tile-002.json": "160869c3a9b7d6f004d0849d32292558546cbd2bcb0b5185c771aaedc58d9615"
        }
      },
      {
        "year": 2012,
        "files_sha256": {
          "manifest.json": "f7ad4430f21619df24316a5f9a3e7c803f95958e63c498b359fb5b67c124dd59",
          "request.json": "537718003547cd0a2bfd64c984afe24cad56dd346e61439f7651eb12a8bd43b0",
          "result.json": "bd6ce3ffd36141c658499e1e2ef3d6955b30873cac04fde325abf7b5389d2fdd",
          "tile-001.json": "1639b109d3e1aadccce77a8bd473a7f6b130d2895e2d8604cb70fe85b0dec4d3",
          "tile-002.json": "21161d0144aba1265f9aff9c7c024c938ae85620ffab5e9b2c753d3fc78be2b3"
        }
      },
      {
        "year": 2013,
        "files_sha256": {
          "manifest.json": "0fd9cb2332fed9cda80b739c38475b1cb3633af1d634868eb6d6c2609580a557",
          "request.json": "f65af4619741d4acc6c1c8a910acc70c36fc6b18c1ecf26937be87b395212456",
          "result.json": "8334c5eccbcfc0c98ce6663526b81a653af2ba414f836136ff9be2d4f27d3f9d",
          "tile-001.json": "2fa92f4dd6a1484515d4732b46ba8cecaee0ba0c487dd5b968de422bc36876d3",
          "tile-002.json": "1ceca23ad299e7426d9034c2af6e1d9ee4aedc6495e7ed0673bf244e92eac8e2"
        }
      },
      {
        "year": 2014,
        "files_sha256": {
          "manifest.json": "9d8e8681934802299313b8b6f7720c9005cc9a8baab3c0630dcb06305718c76d",
          "request.json": "eb18561323c270cd1f8064731fc6d38af16e4a3166be3a283d6a385991063a07",
          "result.json": "3eae826dbc97f2e68cc52ebb22d1fa6441bd6503e6a69f52b07d7c8371508d81",
          "tile-001.json": "4f6144256b50a81675013b6047cb0db0f348752b3c88ddd202c9b552dcbc0f7e",
          "tile-002.json": "cf572b9f84a73193338ca53211ce936bdb66be907b455c547c096e66014832f5"
        }
      },
      {
        "year": 2015,
        "files_sha256": {
          "manifest.json": "c1cd259130b42a9d1d80654b2c12a8a8eff33651374206a6d384353555225d12",